{
  "schemaVersion": "1.0",
  "profile": "TenantReplica",
  "profilePolicy": {
    "denyWorkflows": false,
    "denyEvidence": true,
    "denyTenantTransitions": true,
    "denyPrivateState": true,
    "denySourceHistory": true,
    "denyUntrackedFiles": true
  },
  "deniedPaths": [
    "infra/evidence",
    "publication",
    "artifacts"
  ],
  "tenantAlias": "source-lab",
  "customerScope": "Synthetic Task 3 policy example only; not an operational manifest or Plan 4 retained-tree acceptance",
  "retainedTenantArtifacts": [
    {
      "path": "infra/src/config/tenants/_template.psd1",
      "artifactKind": "TenantManifest",
      "customerScope": "Required reusable template only; no source-tenant intent or transition payload"
    }
  ],
  "replacements": [],
  "residualMarkers": [],
  "sourceMarkerCatalog": [],
  "residualDispositions": [],
  "syntheticDataPolicy": {
    "reservedNames": ["Synthetic Operator"],
    "reservedDomains": ["example.invalid"],
    "reservedIdPrefixes": ["synthetic-"]
  },
  "fileClassifications": [],
  "inspectableBinaries": [],
  "validationSuites": ["Pester", "RepositorySafety", "BicepBuild"]
}
